{
  "$schema": "https://json-schema.org/draft/2020-12/schema",
  "$id": "https://andrewgrowney.com/schemas/march-madness-ml/team-page.schema.json",
  "title": "March Madness Team Page Payload",
  "description": "Rich team-season payload used by Team Insights. This is fetched on demand and can include deeper resume and similarity detail than the lightweight team index.",
  "type": "object",
  "additionalProperties": false,
  "required": [
    "id",
    "year",
    "name",
    "record",
    "quad_wins",
    "quad_losses",
    "conf",
    "stat_rankings",
    "stats",
    "coach",
    "win_pct",
    "sos",
    "sov",
    "ordinal_data",
    "tournament",
    "similar_teams",
    "exit_round_distribution"
  ],
  "properties": {
    "id": {
      "type": "integer",
      "description": "Kaggle TeamID."
    },
    "year": {
      "type": "integer",
      "minimum": 1985,
      "description": "Season represented by this team payload."
    },
    "name": {
      "type": "string",
      "minLength": 1,
      "description": "Full display name for the team."
    },
    "record": {
      "$ref": "#/$defs/recordSummary"
    },
    "quad_wins": {
      "$ref": "#/$defs/quadBucketMap"
    },
    "quad_losses": {
      "$ref": "#/$defs/quadBucketMap"
    },
    "conf": {
      "type": "string",
      "minLength": 1,
      "description": "Conference identifier used by the website."
    },
    "stat_rankings": {
      "$ref": "#/$defs/numericMap"
    },
    "stats": {
      "$ref": "#/$defs/numericMap"
    },
    "coach": {
      "type": ["string", "null"],
      "description": "Coach identifier or normalized name if available."
    },
    "win_pct": {
      "type": "number",
      "description": "Season win percentage."
    },
    "sos": {
      "type": "number",
      "description": "Strength of schedule metric used in the web experience."
    },
    "sov": {
      "type": "number",
      "description": "Strength of victory metric used in the web experience."
    },
    "ordinal_data": {
      "$ref": "#/$defs/numericMap"
    },
    "tournament": {
      "description": "Tournament summary if the team made the field; null if it did not.",
      "oneOf": [
        {
          "type": "null"
        },
        {
          "$ref": "#/$defs/tournamentSummary"
        }
      ]
    },
    "similar_teams": {
      "type": "array",
      "description": "Ordered similarity matches used in Team Insights.",
      "items": {
        "$ref": "#/$defs/similarTeam"
      }
    },
    "exit_round_distribution": {
      "description": "Model-based tournament exit projection for seeded teams; null for non-tournament teams or if enrichment is unavailable.",
      "oneOf": [
        {
          "type": "null"
        },
        {
          "$ref": "#/$defs/exitRoundDistribution"
        }
      ]
    }
  },
  "$defs": {
    "winLossPair": {
      "title": "Win Loss Pair",
      "type": "array",
      "description": "A two-element tuple of wins and losses.",
      "prefixItems": [
        {
          "type": "integer",
          "minimum": 0
        },
        {
          "type": "integer",
          "minimum": 0
        }
      ],
      "items": false,
      "minItems": 2,
      "maxItems": 2
    },
    "recordSummary": {
      "title": "Record Summary",
      "type": "object",
      "additionalProperties": false,
      "required": [
        "overall",
        "conf",
        "home",
        "road",
        "quad_1",
        "quad_2",
        "quad_3",
        "quad_4"
      ],
      "properties": {
        "overall": { "$ref": "#/$defs/winLossPair" },
        "conf": { "$ref": "#/$defs/winLossPair" },
        "home": { "$ref": "#/$defs/winLossPair" },
        "road": { "$ref": "#/$defs/winLossPair" },
        "quad_1": { "$ref": "#/$defs/winLossPair" },
        "quad_2": { "$ref": "#/$defs/winLossPair" },
        "quad_3": { "$ref": "#/$defs/winLossPair" },
        "quad_4": { "$ref": "#/$defs/winLossPair" }
      }
    },
    "quadGame": {
      "title": "Quadrant Game Entry",
      "type": "object",
      "additionalProperties": false,
      "required": [
        "opp_id",
        "team_score",
        "opp_score",
        "team_loc",
        "date_int",
        "date_str",
        "conf"
      ],
      "properties": {
        "opp_id": {
          "type": "integer",
          "description": "Opponent TeamID."
        },
        "team_score": {
          "type": "integer",
          "minimum": 0
        },
        "opp_score": {
          "type": "integer",
          "minimum": 0
        },
        "team_loc": {
          "type": "string",
          "enum": ["H", "A", "N"],
          "description": "Home, away, or neutral location code."
        },
        "date_int": {
          "type": "integer",
          "minimum": 0,
          "description": "Integer day offset within the season."
        },
        "date_str": {
          "type": "string",
          "minLength": 1,
          "description": "Human-readable game date for the website."
        },
        "conf": {
          "type": "boolean",
          "description": "Whether this was a conference game."
        }
      }
    },
    "quadBucketMap": {
      "title": "Quadrant Bucket Map",
      "type": "object",
      "additionalProperties": false,
      "required": ["1", "2", "3", "4"],
      "properties": {
        "1": {
          "type": "array",
          "items": { "$ref": "#/$defs/quadGame" }
        },
        "2": {
          "type": "array",
          "items": { "$ref": "#/$defs/quadGame" }
        },
        "3": {
          "type": "array",
          "items": { "$ref": "#/$defs/quadGame" }
        },
        "4": {
          "type": "array",
          "items": { "$ref": "#/$defs/quadGame" }
        }
      }
    },
    "numericMap": {
      "title": "Numeric Metric Map",
      "description": "Map of metric names to numeric values. Used for stats, rankings, and ordinals.",
      "type": "object",
      "propertyNames": {
        "type": "string",
        "minLength": 1
      },
      "additionalProperties": {
        "type": "number"
      }
    },
    "tournamentGame": {
      "title": "Tournament Game",
      "type": "object",
      "description": "Optional per-game tournament record if the exporter includes historical tournament games.",
      "additionalProperties": true
    },
    "tournamentSummary": {
      "title": "Tournament Summary",
      "type": "object",
      "additionalProperties": false,
      "required": [
        "seed",
        "games",
        "exit_round"
      ],
      "properties": {
        "seed": {
          "type": ["integer", "null"],
          "minimum": 1,
          "maximum": 16,
          "description": "NCAA tournament seed."
        },
        "games": {
          "type": "array",
          "items": { "$ref": "#/$defs/tournamentGame" },
          "description": "Optional tournament game summaries."
        },
        "exit_round": {
          "type": ["string", "null"],
          "description": "Round name where the team exited, or null if the tournament has not been played yet."
        }
      }
    },
    "similarTeam": {
      "title": "Similar Team",
      "type": "object",
      "additionalProperties": false,
      "required": [
        "id",
        "year",
        "avg",
        "res",
        "st",
        "er"
      ],
      "properties": {
        "id": {
          "type": "integer",
          "description": "Matched historical TeamID."
        },
        "year": {
          "type": "integer",
          "minimum": 1985,
          "description": "Season of the historical similarity match."
        },
        "name": {
          "type": ["string", "null"],
          "description": "Display name for the matched historical team."
        },
        "seed": {
          "type": ["integer", "null"],
          "minimum": 1,
          "maximum": 16,
          "description": "Tournament seed for the matched historical team."
        },
        "avg": {
          "type": "number",
          "description": "Aggregate similarity score used by the website narrative and ranking order."
        },
        "feature_similarity": {
          "type": ["number", "null"],
          "description": "Similarity score across the full tournament feature set before the seed prior is blended in."
        },
        "res": {
          "type": "number",
          "description": "Resume-feature similarity component."
        },
        "st": {
          "type": "number",
          "description": "Tempo and stat-profile similarity component."
        },
        "seed_similarity": {
          "type": ["number", "null"],
          "description": "Seed-based prior blended into the aggregate score."
        },
        "er": {
          "type": ["string", "null"],
          "description": "Historical tournament exit round for the similar team."
        },
        "lost_to_team_id": {
          "type": ["integer", "null"],
          "description": "Opponent TeamID that eliminated the matched historical team, if applicable."
        },
        "lost_to": {
          "type": ["string", "null"],
          "description": "Opponent name that eliminated the matched historical team, if applicable."
        },
        "loss_score": {
          "type": ["string", "null"],
          "description": "Final score from the matched historical team's elimination game, formatted as team-opp."
        }
      }
    },
    "exitRoundModel": {
      "title": "Exit Round Model Metadata",
      "type": "object",
      "additionalProperties": false,
      "required": [
        "id",
        "family",
        "feature_set",
        "training_season_range",
        "validation_season",
        "calibrated"
      ],
      "properties": {
        "id": {
          "type": "string",
          "minLength": 1
        },
        "family": {
          "type": "string",
          "minLength": 1
        },
        "feature_set": {
          "type": "string",
          "minLength": 1
        },
        "training_season_range": {
          "type": "array",
          "prefixItems": [
            {
              "type": "integer",
              "minimum": 1985
            },
            {
              "type": "integer",
              "minimum": 1985
            }
          ],
          "items": false,
          "minItems": 2,
          "maxItems": 2
        },
        "validation_season": {
          "type": ["integer", "null"],
          "minimum": 1985
        },
        "calibrated": {
          "type": "boolean"
        }
      }
    },
    "probabilityMap": {
      "title": "Probability Map",
      "type": "object",
      "additionalProperties": false,
      "required": [
        "round64",
        "round32",
        "sweet16",
        "elite8",
        "final4",
        "championship",
        "champion"
      ],
      "properties": {
        "round64": { "type": "number" },
        "round32": { "type": "number" },
        "sweet16": { "type": "number" },
        "elite8": { "type": "number" },
        "final4": { "type": "number" },
        "championship": { "type": "number" },
        "champion": { "type": "number" }
      }
    },
    "thresholdProbabilityMap": {
      "title": "Threshold Probability Map",
      "type": "object",
      "additionalProperties": false,
      "required": [
        "sweet16_plus",
        "elite8_plus",
        "final4_plus",
        "title_game_plus"
      ],
      "properties": {
        "sweet16_plus": { "type": "number" },
        "elite8_plus": { "type": "number" },
        "final4_plus": { "type": "number" },
        "title_game_plus": { "type": "number" }
      }
    },
    "exitRoundDistribution": {
      "title": "Exit Round Distribution",
      "type": "object",
      "additionalProperties": false,
      "required": [
        "model",
        "expected_exit_round",
        "most_likely_round_num",
        "most_likely_round",
        "floor_round_num",
        "floor_round",
        "ceiling_round_num",
        "ceiling_round",
        "seed_expected_round",
        "seed_delta",
        "region_rank",
        "probabilities",
        "threshold_probabilities"
      ],
      "properties": {
        "model": {
          "$ref": "#/$defs/exitRoundModel"
        },
        "expected_exit_round": {
          "type": "number"
        },
        "most_likely_round_num": {
          "type": "integer",
          "minimum": 1,
          "maximum": 7
        },
        "most_likely_round": {
          "type": "string",
          "minLength": 1
        },
        "floor_round_num": {
          "type": "integer",
          "minimum": 1,
          "maximum": 7
        },
        "floor_round": {
          "type": "string",
          "minLength": 1
        },
        "ceiling_round_num": {
          "type": "integer",
          "minimum": 1,
          "maximum": 7
        },
        "ceiling_round": {
          "type": "string",
          "minLength": 1
        },
        "seed_expected_round": {
          "type": "number"
        },
        "seed_delta": {
          "type": "number"
        },
        "region_rank": {
          "type": "integer",
          "minimum": 1
        },
        "probabilities": {
          "$ref": "#/$defs/probabilityMap"
        },
        "threshold_probabilities": {
          "$ref": "#/$defs/thresholdProbabilityMap"
        }
      }
    }
  }
}