{
  "id": 1321,
  "year": 2026,
  "name": "Northwestern",
  "record": {
    "overall": [
      15,
      19
    ],
    "conf": [
      7,
      16
    ],
    "home": [
      9,
      7
    ],
    "road": [
      6,
      12
    ],
    "quad_1": [
      2,
      14
    ],
    "quad_2": [
      2,
      4
    ],
    "quad_3": [
      6,
      1
    ],
    "quad_4": [
      5,
      0
    ]
  },
  "quad_wins": {
    "1": [
      {
        "opp_id": 1231,
        "team_score": 72,
        "opp_score": 68,
        "team_loc": "A",
        "date_int": 113,
        "date_str": "02/24",
        "conf": true
      },
      {
        "opp_id": 1231,
        "team_score": 74,
        "opp_score": 61,
        "team_loc": "N",
        "date_int": 128,
        "date_str": "03/11",
        "conf": true
      }
    ],
    "2": [
      {
        "opp_id": 1177,
        "team_score": 81,
        "opp_score": 79,
        "team_loc": "A",
        "date_int": 11,
        "date_str": "11/14",
        "conf": false
      },
      {
        "opp_id": 1425,
        "team_score": 74,
        "opp_score": 68,
        "team_loc": "A",
        "date_int": 79,
        "date_str": "01/21",
        "conf": true
      }
    ],
    "3": [
      {
        "opp_id": 1376,
        "team_score": 79,
        "opp_score": 77,
        "team_loc": "N",
        "date_int": 20,
        "date_str": "11/23",
        "conf": false
      },
      {
        "opp_id": 1434,
        "team_score": 86,
        "opp_score": 70,
        "team_loc": "H",
        "date_int": 43,
        "date_str": "12/16",
        "conf": false
      },
      {
        "opp_id": 1336,
        "team_score": 94,
        "opp_score": 73,
        "team_loc": "H",
        "date_int": 87,
        "date_str": "01/29",
        "conf": true
      },
      {
        "opp_id": 1268,
        "team_score": 78,
        "opp_score": 74,
        "team_loc": "H",
        "date_int": 107,
        "date_str": "02/18",
        "conf": true
      },
      {
        "opp_id": 1332,
        "team_score": 63,
        "opp_score": 62,
        "team_loc": "H",
        "date_int": 117,
        "date_str": "02/28",
        "conf": true
      },
      {
        "opp_id": 1336,
        "team_score": 76,
        "opp_score": 66,
        "team_loc": "N",
        "date_int": 127,
        "date_str": "03/10",
        "conf": true
      }
    ],
    "4": [
      {
        "opp_id": 1479,
        "team_score": 70,
        "opp_score": 47,
        "team_loc": "H",
        "date_int": 0,
        "date_str": "11/03",
        "conf": false
      },
      {
        "opp_id": 1131,
        "team_score": 76,
        "opp_score": 52,
        "team_loc": "H",
        "date_int": 4,
        "date_str": "11/07",
        "conf": false
      },
      {
        "opp_id": 1156,
        "team_score": 110,
        "opp_score": 63,
        "team_loc": "H",
        "date_int": 7,
        "date_str": "11/10",
        "conf": false
      },
      {
        "opp_id": 1238,
        "team_score": 93,
        "opp_score": 53,
        "team_loc": "H",
        "date_int": 40,
        "date_str": "12/13",
        "conf": false
      },
      {
        "opp_id": 1224,
        "team_score": 80,
        "opp_score": 60,
        "team_loc": "H",
        "date_int": 57,
        "date_str": "12/30",
        "conf": false
      }
    ]
  },
  "quad_losses": {
    "1": [
      {
        "opp_id": 1438,
        "team_score": 78,
        "opp_score": 83,
        "team_loc": "N",
        "date_int": 18,
        "date_str": "11/21",
        "conf": false
      },
      {
        "opp_id": 1458,
        "team_score": 73,
        "opp_score": 85,
        "team_loc": "A",
        "date_int": 30,
        "date_str": "12/03",
        "conf": true
      },
      {
        "opp_id": 1326,
        "team_score": 82,
        "opp_score": 86,
        "team_loc": "H",
        "date_int": 33,
        "date_str": "12/06",
        "conf": true
      },
      {
        "opp_id": 1277,
        "team_score": 66,
        "opp_score": 76,
        "team_loc": "A",
        "date_int": 66,
        "date_str": "01/08",
        "conf": true
      },
      {
        "opp_id": 1228,
        "team_score": 68,
        "opp_score": 79,
        "team_loc": "H",
        "date_int": 72,
        "date_str": "01/14",
        "conf": true
      },
      {
        "opp_id": 1304,
        "team_score": 58,
        "opp_score": 77,
        "team_loc": "H",
        "date_int": 75,
        "date_str": "01/17",
        "conf": true
      },
      {
        "opp_id": 1417,
        "team_score": 64,
        "opp_score": 71,
        "team_loc": "A",
        "date_int": 82,
        "date_str": "01/24",
        "conf": true
      },
      {
        "opp_id": 1228,
        "team_score": 44,
        "opp_score": 84,
        "team_loc": "A",
        "date_int": 93,
        "date_str": "02/04",
        "conf": true
      },
      {
        "opp_id": 1234,
        "team_score": 70,
        "opp_score": 76,
        "team_loc": "A",
        "date_int": 97,
        "date_str": "02/08",
        "conf": true
      },
      {
        "opp_id": 1276,
        "team_score": 75,
        "opp_score": 87,
        "team_loc": "H",
        "date_int": 100,
        "date_str": "02/11",
        "conf": true
      },
      {
        "opp_id": 1304,
        "team_score": 49,
        "opp_score": 68,
        "team_loc": "A",
        "date_int": 103,
        "date_str": "02/14",
        "conf": true
      },
      {
        "opp_id": 1345,
        "team_score": 66,
        "opp_score": 70,
        "team_loc": "H",
        "date_int": 121,
        "date_str": "03/04",
        "conf": true
      },
      {
        "opp_id": 1278,
        "team_score": 66,
        "opp_score": 67,
        "team_loc": "A",
        "date_int": 124,
        "date_str": "03/07",
        "conf": true
      },
      {
        "opp_id": 1345,
        "team_score": 68,
        "opp_score": 81,
        "team_loc": "N",
        "date_int": 129,
        "date_str": "03/12",
        "conf": true
      }
    ],
    "2": [
      {
        "opp_id": 1329,
        "team_score": 81,
        "opp_score": 86,
        "team_loc": "N",
        "date_int": 24,
        "date_str": "11/27",
        "conf": false
      },
      {
        "opp_id": 1139,
        "team_score": 58,
        "opp_score": 61,
        "team_loc": "N",
        "date_int": 47,
        "date_str": "12/20",
        "conf": false
      },
      {
        "opp_id": 1278,
        "team_score": 78,
        "opp_score": 84,
        "team_loc": "H",
        "date_int": 61,
        "date_str": "01/03",
        "conf": true
      },
      {
        "opp_id": 1449,
        "team_score": 62,
        "opp_score": 76,
        "team_loc": "H",
        "date_int": 89,
        "date_str": "01/31",
        "conf": true
      }
    ],
    "3": [
      {
        "opp_id": 1353,
        "team_score": 75,
        "opp_score": 77,
        "team_loc": "A",
        "date_int": 69,
        "date_str": "01/11",
        "conf": true
      }
    ],
    "4": []
  },
  "conf": "big_ten",
  "stat_rankings": {
    "Points": 219,
    "Poss": 320,
    "OE": 114,
    "DE": 218,
    "NE": 159,
    "FGM": 167,
    "FGA": 261,
    "FGM3": 310,
    "FGA3": 308,
    "FTM": 198,
    "FTA": 230,
    "OR": 309,
    "DR": 335,
    "Ast": 18,
    "TO": 363,
    "Stl": 254,
    "Blk": 131,
    "Fouls": 223,
    "FG%": 97,
    "FG3%": 186,
    "EFG%": 165,
    "FT%": 69,
    "OppPoints": 259,
    "OppFGM": 263,
    "OppFGA": 272,
    "OppFGM3": 215,
    "OppFGA3": 198,
    "OppFTM": 208,
    "OppFTA": 232,
    "OppOR": 110,
    "OppDR": 251,
    "OppAst": 38,
    "OppTO": 207,
    "OppStl": 359,
    "OppBlk": 348,
    "OppFouls": 284,
    "OppFG%": 204,
    "OppFG3%": 244,
    "OppEFG%": 203,
    "OppFT%": 67,
    "AdjOE": 64,
    "AdjDE": 62,
    "AdjNE": 60,
    "SOS": 27,
    "SOV": 109
  },
  "stats": {
    "Points": 73.147,
    "Poss": 66.698,
    "OE": 109.64,
    "DE": 108.334,
    "NE": 1.306,
    "FGM": 26.176,
    "FGA": 56.735,
    "FGM3": 6.353,
    "FGA3": 19.265,
    "FTM": 14.441,
    "FTA": 19.235,
    "OR": 7.471,
    "DR": 19.765,
    "Ast": 17.235,
    "TO": 8.147,
    "Stl": 5.794,
    "Blk": 3.559,
    "Fouls": 17.118,
    "FG%": 0.462,
    "FG3%": 0.339,
    "EFG%": 0.519,
    "FT%": 0.753,
    "OppPoints": 71.971,
    "OppFGM": 24.941,
    "OppFGA": 56.353,
    "OppFGM3": 7.559,
    "OppFGA3": 22.647,
    "OppFTM": 14.529,
    "OppFTA": 19.618,
    "OppOR": 9.441,
    "OppDR": 21.706,
    "OppAst": 15.912,
    "OppTO": 10.618,
    "OppStl": 4.794,
    "OppBlk": 2.412,
    "OppFouls": 16.294,
    "OppFG%": 0.445,
    "OppFG3%": 0.329,
    "OppEFG%": 0.512,
    "OppFT%": 0.745,
    "AdjOE": 117.051,
    "AdjDE": 96.493,
    "AdjNE": 20.558
  },
  "coach": "chris_collins",
  "win_pct": 0.441,
  "sos": 0.564,
  "sov": 0.456,
  "ordinal_data": {
    "NET": 70
  },
  "tournament": null,
  "similar_teams": [],
  "exit_round_distribution": null
}